{
  "$schema": "https://json-schema.org/draft/2020-12/schema",
  "title": "Registry Configuration",
  "description": "Declares how a component registry extends the base spec.",
  "type": "object",
  "required": [
    "name",
    "description",
    "agentMetaId",
    "tileDir",
    "facets",
    "indexSchemaVersion",
    "repo",
    "base"
  ],
  "properties": {
    "name": {
      "type": "string",
      "description": "Registry name (e.g., 'uswds-ai-components')"
    },
    "description": {
      "type": "string",
      "description": "One-line description of the registry"
    },
    "designSystem": {
      "type": "object",
      "description": "The design system this registry covers",
      "properties": {
        "name": {
          "type": "string"
        },
        "version": {
          "type": "string"
        },
        "url": {
          "type": "string"
        },
        "package": {
          "type": "string",
          "description": "npm package carrying the pinned design-system release (e.g. @uswds/uswds). Its devDependency must match designSystem.version exactly — the validator cross-checks the pin (protocol.md Design-System Version Sync)."
        },
        "verification": {
          "type": "object",
          "description": "How this registry proves its tiles match the pin (protocol.md Verification strategy; procedure in deep-check.md). Declare it so the check is repeatable rather than remembered.",
          "properties": {
            "markup": {
              "type": "string",
              "enum": ["package-templates", "package-css", "live-html", "none"],
              "description": "What proves a class or structure is canon. Set with 'styling' when the design system ships templates: a class can be canonical markup with no CSS rules."
            },
            "styling": {
              "type": "string",
              "enum": ["package-css", "live-css", "none"],
              "description": "What proves a class carries style rules."
            },
            "packagePath": {
              "type": "string",
              "description": "Path to the stylesheet/templates inside the registry (also referenced by staticView.css)"
            },
            "groundTruth": {
              "type": "string",
              "enum": ["installed-package", "live-site", "documentation"],
              "description": "installed-package is immutable and CI-installable; live-site is a snapshot, not a mechanism"
            }
          }
        }
      }
    },
    "agentMetaId": {
      "type": "string",
      "description": "The HTML id of the embedded metadata block (e.g., 'uswds-agent-meta')"
    },
    "tileDir": {
      "type": "string",
      "description": "Directory containing component tiles (e.g., 'infinite')"
    },
    "facets": {
      "type": "array",
      "items": {
        "type": "string"
      },
      "description": "List of facet field names to aggregate in facets.json"
    },
    "indexSchemaVersion": {
      "type": "integer",
      "description": "Schema version for components.index.json"
    },
    "metadataSchemaVersion": {
      "type": "integer",
      "description": "Metadata schema version for tile agent-meta blocks. v1 = flat structure, v2 = categorized (discovery/selection/instruction/constraints)",
      "default": 1
    },
    "taxonomyVersion": {
      "type": "integer",
      "description": "Optional taxonomy version for the facet vocabulary"
    },
    "staticView": {
      "type": "object",
      "description": "Resolved-view generation inputs (see _base/generate-resolved-view.mjs). Resolved views are generated computed-style companions skipped by index/validator.",
      "properties": {
        "css": {
          "type": "array",
          "items": {
            "type": "string"
          },
          "description": "Stylesheets (paths relative to registry root) injected into every tile at generation time. Use when tiles rely on external design-system CSS."
        },
        "viewport": {
          "type": "object",
          "properties": {
            "width": {
              "type": "integer",
              "default": 1280
            },
            "height": {
              "type": "integer",
              "default": 4000
            }
          }
        },
        "classCheck": {
          "type": "object",
          "description": "Class ground-truth validation: every tile-DOM class with `prefix` must be defined by the staticView.css stylesheets or allowlisted here (with reason). Catches hallucinated design-system classes.",
          "properties": {
            "prefix": {
              "type": "array",
              "items": { "type": "string" },
              "default": ["usa-"],
              "description": "Class prefixes this design system uses — one per namespace. Registries whose components span several (GOV.UK's govuk-/gem-/app-, canada.ca's wb-/btn-/form-/gc-) must declare all of them, otherwise those classes are silently unchecked. A bare string is still accepted."
            },
            "allowlist": {
              "type": "array",
              "items": {
                "oneOf": [
                  {
                    "type": "string"
                  },
                  {
                    "type": "object",
                    "properties": {
                      "class": {
                        "type": "string"
                      },
                      "reason": {
                        "type": "string",
                        "description": "Why this class is exempt (JS mount, documented no-op, registry demo class)"
                      }
                    },
                    "required": [
                      "class",
                      "reason"
                    ]
                  }
                ]
              }
            }
          }
        }
      }
    },
    "repo": {
      "type": "string",
      "description": "GitHub repo URL"
    },
    "base": {
      "type": "string",
      "description": "Base URL for raw file fetching (raw.githubusercontent.com/...)"
    },
    "additionalFields": {
      "type": "array",
      "items": {
        "type": "string"
      },
      "description": "Non-standard fields included in each tile's metadata"
    },
    "govCompliance": {
      "type": "array",
      "items": {
        "type": "string"
      },
      "description": "Government compliance standards this registry supports"
    },
    "supportedDesignSystems": {
      "type": "array",
      "items": {
        "type": "string"
      },
      "description": "Design systems that have classMapping entries in this registry's tiles (e.g., ['material', 'bootstrap'])"
    },
    "adapterBase": {
      "type": "string",
      "description": "Base URL for adapter registry (cross-design system semantic mappings)"
    },
    "compatibilityPath": {
      "type": "string",
      "description": "Path to the family-level compatibility map, relative to the registry root (default: compatibility.json; monorepo registries may point at a shared cross/ directory)",
      "default": "compatibility.json"
    },
    "mcp": {
      "type": "object",
      "description": "MCP server capability advertisement",
      "properties": {
        "enabled": {
          "type": "boolean",
          "description": "Whether this registry ships an MCP server entry point",
          "default": true
        },
        "server": {
          "type": "string",
          "description": "Path to the MCP server entry point (relative to registry root)",
          "default": "_base/mcp/server.mjs"
        },
        "transport": {
          "type": "string",
          "enum": [
            "stdio"
          ],
          "description": "Transport supported by the server",
          "default": "stdio"
        },
        "tools": {
          "type": "array",
          "items": {
            "type": "string"
          },
          "description": "Tool names exposed by the server",
          "default": [
            "search_components",
            "get_component",
            "list_facets",
            "get_index",
            "get_adapter",
            "translate_component",
            "get_recipe",
            "query_compliance",
            "get_versions"
          ]
        }
      }
    },
    "gaps": {
      "type": "array",
      "description": "Declared component-concept gaps: design-system components or patterns this registry intentionally does not tile, with the nearest available alternative. Agents query this instead of inferring from absence. Doctrine-backed omissions (status not_part_of_design_system) must cite source and state consequence — the registry records doctrine with sources, it never authors it.",
      "items": {
        "type": "object",
        "required": [
          "concept",
          "status",
          "reason"
        ],
        "properties": {
          "concept": {
            "type": "string",
            "description": "Component concept name (e.g. combobox, card, mega-menu)"
          },
          "status": {
            "type": "string",
            "enum": [
              "not_part_of_design_system",
              "deferred"
            ],
            "description": "not_part_of_design_system = doctrine/pattern, do not invent; deferred = candidate for a future tile"
          },
          "nearestAlternative": {
            "type": "string",
            "description": "Tiled family or recipe to use instead"
          },
          "reason": {
            "type": "string"
          },
          "consequence": {
            "type": "string",
            "description": "What an implementing agent must do instead, as an instruction-shaped consequence (e.g. 'do NOT add a page-level error summary; field-level messaging is the sanctioned pattern'). Required when status is not_part_of_design_system."
          },
          "source": {
            "type": "string",
            "description": "Where the design system documents this omission (URL or citation). Required when status is not_part_of_design_system: the registry records doctrine with sources, it never authors it."
          }
        },
        "if": {
          "properties": {
            "status": {
              "const": "not_part_of_design_system"
            }
          }
        },
        "then": {
          "required": [
            "consequence",
            "source"
          ]
        }
      }
    },
    "tokenProfiles": {
      "type": "object",
      "description": "Named token override sets components can declare support for (e.g. highContrast, darkMode, compactDensity). Keys are profile names; values have description + tokenOverrides.",
      "additionalProperties": {
        "type": "object",
        "properties": {
          "description": {
            "type": "string"
          },
          "tokenOverrides": {
            "type": "object",
            "description": "Token name → override value applied when this profile is active"
          }
        }
      }
    },
    "updated": {
      "type": "string",
      "description": "Version string for the registry"
    },
    "behaviorContract": {
      "type": "boolean",
      "description": "When true, validate-registry.mjs enforces instruction.behavior on every tile whose requiresJs is required or optional (tile-format.md Behavior Fields)."
    },
    "patternGuidance": {
      "type": "boolean",
      "description": "When true, the registry publishes Surface 6 pattern guidance (protocol.md): generate-index.mjs emits patterns/index.json and normalizes discovery.patterns into index records; validate-registry.mjs enforces pattern-file rules (required citations, cross-references to real tiles/recipes). Task-to-component-set guidance only — never page design."
    },
    "modifierSeparators": {
      "type": "array",
      "items": {
        "type": "string"
      },
      "description": "Modifier separators this design system uses (longest first, e.g. [\"--\", \"__\", \"-\"]). Consumed by analysis tooling (e.g. detect-convergence.mjs) to canonicalize class spellings before grouping. See protocol.md Design-System Version Sync and Surface 7."
    }
  }
}
